{
  "schema_version": 1,
  "language": "en",
  "profiles": [
    {
      "alias": "main",
      "type": "smallhost",
      "host": "s1.small.pl",
      "port": 22,
      "user": "testuser",
      "properties": {
        "ssl_mode": "letsencrypt"
      }
    }
  ],
  "projects": [
    {
      "id": "0c4a4f5a-3a6f-4f4f-9a3a-3a6f4f4f9a3a",
      "domain": "demo.testuser.smallhost.pl",
      "profile_alias": "main",
      "repo": "dilitS/demo",
      "local_path": "/Users/me/projects/demo",
      "stack": "vite-react",
      "node_version": "20.11.0",
      "imported_at": "2026-05-22T10:30:00Z",
      "secrets_meta": [
        {
          "key": "DB_PASSWORD",
          "created_at": "2026-05-22T10:30:00Z",
          "last_rotated": "2026-05-22T10:30:00Z",
          "source": "managed",
          "rotation_reminder_days": 90
        }
      ]
    }
  ],
  "settings": {
    "refresh_interval_s": 60
  }
}
